Title,Source,Posted,Link,Description
Containment of Los Angeles-area Eaton and Palisades fires increases as weather...,CBS News,3 days ago · ,https://www.cbsnews.com/losangeles/news/containment-of-los-angeles-area-eaton-and-palisades-fires-increases-as-weather-conditions-improve/,"Firefighters continue to contain and suppress both of the Los Angeles area fires Thursday, as winds... "
Los Angeles Tree Advocates Hope Their Vital Work Recovers From Devastating Fires,US News & World Report,7 days ago · ,https://www.usnews.com/news/us/articles/2025-01-12/los-angeles-tree-advocates-wait-and-hope-that-fire-damage-wont-be-too-severe,"Some people across Los Angeles have worked for years to increase the number of trees that give respite from heat and air pollution. The tree advocates have confronted increasing drought, bad ... "
Los Angeles County Sheriff Seeks Public's Help Locating At-Risk Missing...,Sierra Sun Times,20 hours ago · ,https://www.goldrushcam.com/sierrasuntimes/index.php/news/california/63825-los-angeles-county-sheriff-seeks-public-s-help-locating-at-risk-missing-81-year-old-charles-ross-last-seen-in-altadena,Los Angeles County Sheriff’s Department officials report that the Missing Persons Unit is asking for... 
Navajo Nation firefighters battle wildfires in Los Angeles,WDTN-TV 2 Dayton,1 day ago · ,https://www.wdtn.com/news/u-s-world/ap-us-news/ap-navajo-nation-firefighters-battle-wildfires-in-los-angeles/,LOS ANGELES (AP) — Firefighters from the Navajo Nation worked tirelessly through a haze of dust to... 
Los Angeles evacuees told to stay away from home at least another week By...,Investing.com,3 days ago · ,https://www.investing.com/news/world-news/weather-conditions-in-los-angeles-improve-giving-firefighters-respite-3816788,"Landslides further endangered the devastated hillsides, where leveled structures no longer hold... "
A ‘Particularly Dangerous Situation’ is forecast for fire-scarred Los Angeles...,WMBD - FOX 43 Peoria,4 days ago · ,https://www.centralillinoisproud.com/news/national/ap-firefighters-prepare-for-increasing-gusts-following-brief-reprieve-for-la-area/,LOS ANGELES (AP) — Millions of Southern Californians were on edge as a final round of dangerous fire... 
Los Angeles evacuees told to stay away from home at least another week,Reuters,3 days ago · ,https://www.reuters.com/world/us/weather-conditions-los-angeles-improve-giving-firefighters-respite-2025-01-16/,"Landslides further endangered the devastated hillsides, where leveled structures no longer hold... "
Los Angeles tree advocates hope their vital work recovers from devastating fires,Associated Press,7 days ago · ,https://apnews.com/article/trees-california-fires-03313d49c69d4768164f7f87a540edc6,"Some people across Los Angeles have worked for years to increase the number of trees that give respite from heat and air pollution. The tree advocates have confronted increasing drought, bad ... "
A ‘Particularly Dangerous Situation’ is forecast for fire-scarred Los Angeles...,WRIC 8 News Richmond,4 days ago · ,https://www.wric.com/news/u-s-world/ap-firefighters-prepare-for-increasing-gusts-following-brief-reprieve-for-la-area/,LOS ANGELES (AP) — Millions of Southern Californians were on edge as a final round of dangerous fire... 
LA Dodgers Star Shohei Ohtani Announces Donation to Firefighters & More Amid Los...,Just Jared,2 days ago · ,https://www.justjared.com/2025/01/17/la-dodgers-star-shohei-ohtani-announces-donation-to-firefighters-more-amid-los-angeles-fires/,Shohei Ohtani has announced a monetary contribution to those on the frontlines amid the Los Angeles... 
All 12 Los Angeles-area professional sports teams donate $8 million to fire...,Yahoo Sports ·  via AOL,6 days ago · ,https://www.aol.com/12-los-angeles-area-professional-210643787.html,"The money will be spread out among several organizations, including the American Red Cross, the Los... "
Fire-scarred LA area faces new gusts,China Daily,4 days ago · ,https://global.chinadaily.com.cn/a/202501/15/WS67870b55a310f1265a1dae1d.html,"As the fire-ravaged Los Angeles area braced for intense winds on Tuesday, criticism has mounted over the state of California's preparedness and response, while residents and volunteers have ... "
Firefighters are gaining ground in Los Angeles. When will the fires finally end?,Washington Post,3 days ago · ,https://www.washingtonpost.com/weather/2025/01/15/la-fires-palisades-eaton-containment/,"Eight days into Los Angeles’s most destructive firestorm on record, and the initial wave of the... "
What is the pink stuff coating fire-ravaged Los Angeles?,The Raw Story,4 days ago · ,https://www.rawstory.com/california-wildfires-2670834863/,Above the roaring fires devastating parts of Los Angeles is an incongruous sight: air tankers... 
Rare 'particularly dangerous situation' forecast for fire-scarred Los Angeles,ABC 7 Gulfshore News,4 days ago · ,https://www.abc-7.com/article/southern-california-fire-weather-warning/63430257,The Eaton Fire burning just north of Los Angeles and the Palisades Fire that destroyed much of the... 
"The Weeknd postpones show, album release amid LA fires",Rolling Out,22 hours ago · ,https://rollingout.com/2025/01/18/the-weeknd-donates-big-to-la-wildfire-relief/,The 34-year-old singer — whose real name is Abel Tesfaye — has donated $1 million across three... 
Fires burn Los Angeles schools and destroy outdoor education sanctuaries,Las Vegas Sun,6 days ago · ,https://lasvegassun.com/news/2025/jan/12/fires-burn-los-angeles-schools-and-destroy-outdoor/,"For Irina Contreras, a program manager for Los Angeles County’s Department of Arts and Culture,... "
What Is The Pink Stuff Coating Fire-ravaged Los Angeles?,International Business Times,4 days ago · ,https://www.ibtimes.com/what-pink-stuff-coating-fire-ravaged-los-angeles-3759270,Above the roaring fires devastating parts of Los Angeles is an incongruous sight: air tankers... 
Los Angeles winds to intensify; officials 'grid searching' for fire victims:...,USA Today,6 days ago · ,https://www.usatoday.com/story/news/nation/2025/01/13/los-angeles-fires-california-wildfire-live-updates-monday/77659385007/,"For the lastest updates on the LA fires, follow USA TODAY's live coverage for Tuesday, Jan. 14. LOS ANGELES − Ominous winds were expected to regain strength Monday, howling through fire-blackened ... "
California officials warn against price gouging as rents soar in fire-stricken...,Newsday,16 hours ago · ,https://www.newsday.com/news/nation/la-fires-rent-gouging-q00783,California Attorney General Rob Bonta said in a statement Saturday that it is illegal for landlords... 
Los Angeles tree advocates hope their vital work recovers from devastating fires,WROC Rochester,7 days ago · ,https://www.rochesterfirst.com/news/national/ap-los-angeles-tree-advocates-wait-and-hope-that-fire-damage-wont-be-too-severe/,LOS ANGELES (AP) — Some people across Los Angeles have worked for years to increase the number of... 
"A national, nonpartisan study of the Los Angeles fires could improve planning...",Phys.org,4 days ago · ,https://phys.org/news/2025-01-national-nonpartisan-los-angeles-future.html,"The Los Angeles fires are a national disaster of epic proportions. City officials, California Gov.... "
A 'Particularly Dangerous Situation' is forecast for fire-scarred Los Angeles...,ABC News,4 days ago · ,https://abcnews.go.com/US/wireStory/dangerous-situation-forecast-fire-scarred-los-angeles-area-117687796,The Eaton Fire burning just north of Los Angeles and the Palisades Fire that destroyed much of the... 
No Title,No Source,No Time,,No Description
